{
  "$schema": "./providers.schema.json",
  "schemaVersion": 1,
  "updated": "2026-10-20",
  "providers": [
    {
      "id": "comss",
      "name": "Comss.one",
      "website": "https://www.comss.ru/",
      "hosts": ["dns.comss.one", "router.comss.one"],
      "ipv4": ["83.220.169.155", "212.109.195.93", "195.133.25.16", "94.250.253.55"],
      "doh": ["https://dns.comss.one/dns-query", "https://router.comss.one/dns-query"]
    },
    {
      "id": "geohide",
      "name": "GeoHide",
      "website": "https://geohide.ru/",
      "hosts": ["dns.geohide.ru", "geohide.ru"],
      "ipv4": ["159.194.200.33", "37.230.192.51", "193.233.112.67", "193.233.112.68", "193.233.112.88", "46.8.158.6"],
      "doh": ["https://dns.geohide.ru/dns-query", "https://geohide.ru/dns-query"]
    },
    {
      "id": "geohide-eu",
      "name": "GeoHide EU",
      "website": "https://geohide.ru/",
      "hosts": ["eu.geohide.ru"],
      "ipv4": ["143.20.64.192", "45.13.237.213", "5.175.161.40", "5.175.161.3", "31.25.239.132"],
      "doh": ["https://eu.geohide.ru/dns-query"]
    },
    {
      "id": "geohide-us",
      "name": "GeoHide US",
      "website": "https://geohide.ru/",
      "hosts": ["us.geohide.ru"],
      "ipv4": ["192.255.159.240", "192.255.159.241", "192.3.233.253", "107.175.76.134"],
      "doh": ["https://us.geohide.ru/dns-query"]
    },
    {
      "id": "zapret",
      "name": "Zapret DNS",
      "website": "https://wiki.zapret.moe/Zapret/zapret-dns",
      "hosts": ["dns.zapret.moe"],
      "ipv4": ["83.217.211.149"],
      "doh": ["https://dns.zapret.moe/dns-query"]
    },
    {
      "id": "dns-ai",
      "name": "DNS-AI",
      "website": "https://dns-ai.ru/",
      "hosts": ["dns.dns-ai.ru"],
      "ipv4": ["194.87.196.13", "45.151.102.219", "186.246.49.127", "192.144.59.14"],
      "doh": ["https://dns.dns-ai.ru/dns-query"]
    },
    {
      "id": "malw",
      "name": "Malw.link",
      "website": "https://info.dns.malw.link/",
      "hosts": ["dns.malw.link"],
      "ipv4": ["179.254.166.171", "164.5.224.81", "95.216.204.218", "80.253.249.40", "84.21.189.133", "193.23.209.189"],
      "doh": ["https://dns.malw.link/dns-query"]
    },
    {
      "id": "astracat",
      "name": "Astracat",
      "hosts": ["dns.astracat.ru"],
      "ipv4": ["135.106.217.200", "85.209.2.112"],
      "doh": ["https://dns.astracat.ru/dns-query"]
    },
    {
      "id": "mafioznik",
      "name": "Mafioznik",
      "hosts": ["dns.mafioznik.xyz"],
      "ipv4": ["103.27.157.38", "103.27.157.100"],
      "doh": []
    },
    {
      "id": "xyz",
      "name": "XyZ DNS",
      "hosts": ["dns.yo1nk.app"],
      "ipv4": ["109.120.137.190"],
      "doh": ["https://dns.yo1nk.app/dns-query"]
    },
    {
      "id": "bezmezhau",
      "name": "Bez mezhau",
      "website": "https://bezmezhau.com/",
      "hosts": ["dns.bezmezhau.com"],
      "ipv4": ["143.20.64.55", "31.58.216.201"],
      "doh": ["https://dns.bezmezhau.com/dns-query"]
    },
    {
      "id": "webshift",
      "name": "WebShift DNS",
      "website": "https://dns.webshiftvpn.ru/",
      "hosts": ["d.webshiftvpn.ru"],
      "ipv4": ["31.31.207.68"],
      "doh": ["https://d.webshiftvpn.ru/dns-query"]
    },
    {
      "id": "xbox",
      "name": "Xbox DNS",
      "website": "https://xbox-dns.ru/",
      "hosts": ["xbox-dns.ru", "dns.xbox-dns.ru"],
      "ipv4": ["111.88.96.54", "111.88.96.55", "111.88.96.56", "111.88.96.57", "111.88.96.50", "111.88.96.51", "176.99.11.77", "80.78.247.254"],
      "doh": ["https://xbox-dns.ru/dns-query"]
    },
    {
      "id": "community",
      "name": "Community pool",
      "website": "https://github.com/AntikFull/AIUnblock",
      "hosts": [],
      "ipv4": ["62.133.62.97", "87.228.47.204", "185.246.223.127", "45.155.204.190", "95.182.120.241"],
      "doh": []
    },
    {
      "id": "shecan",
      "name": "Shecan",
      "website": "https://shecan.ir/",
      "hosts": ["free.shecan.ir"],
      "ipv4": ["178.22.122.100", "185.51.200.2"],
      "doh": ["https://free.shecan.ir/dns-query"]
    },
    {
      "id": "begzar",
      "name": "Begzar",
      "website": "https://begzar.ir/",
      "hosts": ["dns.begzar.ir"],
      "ipv4": ["185.55.226.26", "185.55.225.25"],
      "doh": ["https://dns.begzar.ir/dns-query"]
    },
    {
      "id": "electro",
      "name": "Electro",
      "website": "https://electrotm.org/",
      "hosts": [],
      "ipv4": ["78.157.42.100", "78.157.42.101"],
      "doh": []
    }
  ],
  "retiredIpv4": []
}
